### ISSUE TITLE
CONNECT tunnel receives TLS/HTTP data but session is missing from UI

### ISSUE THREAD

**Issue by bugficks** [ProxymanApp/Proxyman#2576]
## Description

When using Android Emulator with an HTTP proxy, Proxyman fails to display some domains in the capture UI that are visible in tools like Charles, despite Proxyman receiving and forwarding the traffic.

Running the **same Proxyman version inside a macOS VM on the same host** makes the missing domains appear, with no changes to the emulator, app, or traffic — only the proxy IP changes.

This points to a host-macOS–specific session attribution / promotion issue rather than a proxy, emulator, or network problem.

---

### Host macOS

-   Proxyman: `10.0.2.2:9090`
-   Charles: `10.0.2.2:8888`

### macOS VM on same host

-   Proxyman: `10.211.55.13:9090`
-   Charles: `10.211.55.13:8888`

---

## Reproduction script

```sh
APP_ID=jp.co.omron.healthcare.omron_connect

for port in "9090" "8888"; do
    for ip in "10.0.2.2" "10.211.55.13"; do
        adb shell settings put global http_proxy "${ip}:${port}"
        adb shell am force-stop "${APP_ID}"
        adb shell pm clear --cache-only "${APP_ID}"
        adb shell monkey -p "${APP_ID}" -c android.intent.category.LAUNCHER 1
        adb shell sleep 20
    done
done
```

---

## Packet-level verification

Proxyman **does receive and forward** the traffic, confirmed via tcpdump on the proxy port:

```sh
sudo tcpdump -i lo0 -n -s0 -A \
  'tcp port 9090 and (((tcp[tcpflags] & (tcp-syn|tcp-fin|tcp-rst)) == 0))'
```

### Example output for a domain missing in Proxyman UI

```log
06:10:58.252291 IP 127.0.0.1.58423 > 127.0.0.1.9090: Flags [P.], seq 0:493, ack 1, win 6380, options [nop,nop,TS val 2131942056 ecr 1392914627], length 493
E..!..@.@............7#....Hi..............
....S.0.GET http://data-sg.omronconnect.com/ HTTP/1.1
Host: data-sg.omronconnect.com
Proxy-Connection: keep-alive
Upgrade-Insecure-Requests: 1
User-Agent: Mozilla/5.0 (Linux; Android 13; sdk_gphone64_arm64) AppleWebKit/537.36 (KHTML, like Gecko) Chrome/109.0.0.0 Mobile Safari/537.36
Accept: text/html,application/xhtml+xml,application/xml;q=0.9,image/avif,image/webp,image/apng,*/*;q=0.8,application/signed-exchange;v=b3;q=0.9
Accept-Encoding: gzip, deflate
Accept-Language: en-US,en;q=0.9


06:10:58.252325 IP 127.0.0.1.9090 > 127.0.0.1.58423: Flags [.], ack 493, win 6373, options [nop,nop,TS val 1392914639 ecr 2131942056], length 0
E..4..@.@...........#..7i......5.....(.....
S.0.....
06:10:58.848713 IP 127.0.0.1.9090 > 127.0.0.1.58423: Flags [P.], seq 1:352, ack 493, win 6373, options [nop,nop,TS val 1392915235 ecr 2131942056], length 351
E.....@.@...........#..7i......5...........
S.3#....HTTP/1.1 403 Forbidden
```

This shows:

-   The request reaches Proxyman
-   Proxyman forwards it and returns a response
-   TCP/TLS flow is healthy
-   **No corresponding session appears in Proxyman UI on host macOS**

---

## Expected behavior

Any CONNECT or HTTP tunnel that Proxyman accepts and forwards (with active data flow) should appear in the capture UI, as it does in Charles and in Proxyman when run inside a macOS VM.

---

## Actual behavior

Some domains (e.g. `data-sg.omronconnect.com`) are missing from Proxyman UI on host macOS, despite confirmed traffic on the proxy socket.

---

## Environment

-   VM vs host difference isolates the issue to host macOS behavior
-   Proxyman Version 6.3.0 (60300) | macOS: Version 15.7.3 (Build 24G419)
-   Android emulator version 36.3.10.0 (build_id 14472402) (CL:N/A)
    Image: Google APIs ARM 64 v8a System Image | system-images/android-33/google_apis/arm64-v8a

---

## Screenshots
- charles vs proxyman (host):
   <img width="1154" height="900" alt="Image" src="https://github.com/user-attachments/assets/0ed50c2c-8159-4206-80da-b8c4f8bdb886" />

- charles vs proxyman (vm):
   <img width="1376" height="904" alt="Image" src="https://github.com/user-attachments/assets/6ba6c051-ddd0-4e76-82d4-14fe862cbc00" />

**Comment by NghiaTranUIT** [comment]
Thanks for reporting the detailed bug. I will investigate and fix it.

Meanwhile, can you test with this build: https://github.com/ProxymanApp/Proxyman/issues/2575#issuecomment-3733395363 ?

This Beta build has a new Local VPN on the Android Emulators. The goal is: Capturing all HTTPS traffic and routes to Proxyman. It might fix your issue

**Comment by NghiaTranUIT** [comment]
@bugficks Here is how I test it. You can test it with the latest production build or the Beta build in the above comment 

1. Open your Android Emulator with your app first
2. Open Proxyman -> Certificate Menu -> Install Certificates for Android -> Emulators
3. Click on the Override Emulators

![Image](https://github.com/user-attachments/assets/564e0343-7274-4ae1-8d09-8d132c0f253d)

4. Try opening your Android app and verify if `data-sg.omronconnect.com ` appears on Proxyman.
5. I tested and it works

<img width="1905" height="1185" alt="Image" src="https://github.com/user-attachments/assets/d1167322-6e66-45f8-ae8f-746365d2f6b3" />

**Comment by bugficks** [comment]
Thanks for the quick response. It only happened when using the app on the emulator; opening the same URL in the browser worked fine.
Here’s the kicker: today, when I continued, the requests are showing up.
Same emulator image, no changes, no reboot, nothing. Sorry for wasting your time — still scratching my head about what might have caused this and whether it could happen again.
